0	"b""Georgia 'downs two Russian warplanes' as countries move to brink of war"""
1	Canadian government fires all non-Christian Chaplains in federal prisons
0	"
How the banking crash sparked a credit union boom: People are turning away from casino finance and towards a more democratic system that isn't just about money-making
"
0	14-year-old Pakistani activist Malala Yousafzai has been shot; she had been on a Taliban 'hit list' since March after giving her diary to the BBC in the wake of women being forbidden an education in her town
0	Scotland will hold a vote in 2014 on independence in what could result in the eventual breakup of Britain
0	"A group of 23 impoverished west African fishing communities has driven off a fleet of illegal, unreported &amp; unregulated ""pirate"" trawlers by filming &amp; reporting them when they are found in their waters.  9 of the 10 ships identified  were found to have licences to export catches to Europe."
1	Italian church to be stripped of tax exemption from 2013: The extra revenue from these exempt properties - including hotels, restaurants and sports centres - could be 25.5m a year in Rome alone
1	The shadow of ACTA is back in Europe, disguised as CETA (Canada-European Union and Trade Agreement): A comparison of the leaked draft CETA shows it includes a number of the same controversial provisions, specifically concerning criminal enforcement, private enforcement by ISPs, and harsh damages.
1	British computer hacker Gary McKinnon will not be extradited to the US
1	Chinese companies will be able to sue Canada in secret for trying to protect the Canadian environment if FIPPA (Canada-China Foreign Investment Promotion and Protection Act) passes!
0	8,000-yr-old carvings in stone destroyed in Moroccos High Atlas Mountains by Salafists, Muslims who strictly prohibit idolatry - The carvings depicted the sun as a divinity. One of the carvings, called the plaque of the sun, predates the arrival of the Phoenicians in Morocco. 
0	 Shot Pakistani schoolgirl can stand, communicate 
1	Soldier sacked by the army 72 hours before he gets his full pension
0	A 28-year-old Tunisian who was caught on security camera stealing from a man who had fallen onto the tracks on the Stockholm subway and then leaving him to be hit by a train was sentenced to prison, deportation
0	Greedy U.S. billionaire urges Michigan voters to reject free bridge to Canada
1	Memorial to 'Forgotten' Holocaust Opens in Germany for 500,000 Gypsies Also Slaughtered by Nazis  Forward.com
1	Ashok Khemka, a bureaucrat in India, has been transferred out of his job 43 times because of his determination to follow the rules and whistleblowing. A senior career bureaucrat, he simply cannot tolerate corruption, and so, in every job he takes, he does his best to put a stop to it.
0	Incoming Dutch government ditches 'weed pass' plan that would have been available only to residents and that would have effectively banned tourists from Amsterdam's marijuana cafes
1	Amsterdam will not ban tourists from coffee shops, says mayor
0	The home front: Man builds 60ft-long World War I trench in his back garden - and then invites history buffs round for re-enactment
1	The girl was 16. She was raped by men from a higher caste, and her father committed suicide from the shame. The reaction of her community? To call for a change in the age of consent
1	Harassers of women in Cairo now face wrath of vigilantes. 'More and more groups are emerging to make protecting women  and shaming the do-nothing police  a cause'
0	"Poll: Israel viewed negatively around the world,  BBC survey measures public opinion on 22 countries, places Israel in company of North Korea, ahead of only Iran, Pakistan.
"
0	 Ancient Buddhist city of Mes Aynak will be destroyed,  turned into an open pit copper mine
1	Cipla, the Indian drug company that cut prices of cancer drugs earlier this year, slashes prices of three more cancer drugs by 63%...
0	Arm raised in a Nazi-style salute, the leader of Greece's fastest-rising political party surveyed hundreds of young men in black T-shirts as they exploded into cheers. Their battle cry reverberated through the night: Blood! Honour! Golden Dawn! 
0	"With more than 50,000 supporters, The uprising of women in the Arab world"" facebook group is being blocked by Facebook, over a picture of a woman not wearing a veil."
0	UN says access to contraception a human right
0	"
Savita Halappanavar's medically unnecessary death: In the worst way possible, a woman refused a life-saving abortion in Ireland has proved 'pro-life' advocates wrong"
1	Mexico lawmaker introduces bill to legalize marijuana. A leftist Mexican lawmaker on Thursday presented a bill to legalize the production, sale and use of marijuana, adding to a growing chorus of Latin American politicians who are rejecting the prohibitionist policies of the United States.
1	"Turkish Prime Minister: ""I say that Israel is a terrorist state, and its acts are terrorist acts"""
0	"Israel air force drops leaflets across Gaza City warning residents to evacuate homes ""immediately"""
1	Hamas executes six suspected collaborators with Israel; body dragged through street - San Jose Mercury News
1	Egypt protesters set fire to Muslim Brotherhood offices
0	Having survived two assassination attempts, Mexican mayor beaten to death
0	China's party paper falls for Onion joke about Kim Jong Un
1	Girl, 8, to get vaccination shots after court overrules mum (xpost from /r/NewsOfTheWeird)
1	Canada creates $5,000 cap on liability for file sharing lawsuits
1	Less than 24 hours after General Assembly recognizes Palestine as non-member state, Israel responds by approving construction of 3,000new housing units in Jerusalem, West Bank
0	Internet Hangs in Balance as World Governments Meet in Secret
0	Medicinal cannabis to be legalised in Ireland next year
1	North Korean prisoner born in labor camp escaped after 23 brutal years
1	Police and child advocates broke padlocks and busted down doors in a surprise raid of a sweatshop in India, to find a group of children imprisoned beeing forced to make Christmas decorations. The children, as young as 8 years old, were kept in rooms 6 ft by 6 ft and forced to work 19-hour days
1	U.N. summit votes to support Internet eavesdropping. Uses: censorship, identifying BitTorrent and MP3 transfers
1	Gunmen kill senior womens activist in Afghanistan 
1	Calls for a ban on helium balloons as world shortage worsens.  
0	Julian Assange to form Wikileaks Party, run for Australian Senate
0	The Real North Korea Problem - While the world fears its missiles 250,000 innocents, one-third of them children, are being forced to do slave labor on starvation rations and are daily subjected to heinous torture and executions
0	Internet remains unregulated after UN treaty blocked
1	Russia sees panic buying as Mayan apocalypse mania takes root
1	Ireland to legalise abortion
0	S Korea has it's first woman president.
1	Thieves arrested for stealing 6 million pounds of maple syrup in Canada
0	Syria dropping cluster bombs on civilians 
0	"Swaziland Bans Women From Wearing ""Rape-Provoking"" Mini-Skirts, Midriff-Revealing Tops &amp; Low-Rise Jeans.  Offenders face 6-mos in  jail.  ""The act of the rapist is made easy, because it'd be easy to remove half-cloth worn by women.""  Those wearing such clothing are responsible for assaults or rapes."
0	Mexico Bishop Inspires, Infuriates by Telling 1,000s Gathered in Stadium That Politicians are Tied to Organized Crime, Lawmakers' Attempts to Curb Money Laundering are Intentionally Weak, &amp; New Labor Reforms are a Way to Enslave Mexican Workers
0	Putin Says He Will Sign Bill Banning Americans From Adopting Russian Children
0	A 17-year-old Indian girl who was gang-raped killed herself after police pressured her to drop the case and marry one of her attackers, police and a relative said on Thursday.
1	A young Nepali woman returning from Saudi Arabia is robbed by immigration officials and raped by a policeman 
1	In Pakistan: Gunmen stop a van containing teachers that educate girls, shoot and murder 5 teachers and 2 aid workers
0	Australian PM says abolishing compulsory voting would make democracy the plaything of cashed up interest groups.
1	Soccer team walks out on game in Italy after African player is taunted with monkey chants
0	Mother Jailed For Murdering Seven-Year-Old Son, for failing to learn Koran
0	Poachers killed a family of 11 elephants in the biggest single mass shooting of the animals on record in Kenya.
1	Saudi ruling puts end to marriage between 90-year-old man and his 15-year-old bride
1	The world's population could actually start declining.
1	"Saudi Arabia beheads young Sri Lankan maid, despite international campaign for clemency
"
1	German govt  unexpectedly offers Paris concrete support as French troops battle Islamist extremists in Mali -  Though ruling out a combat role, Germany's military will provide transport &amp; medical assistance.
1	"In China's capital, they're calling it the ""airpocalypse,"" with air pollution that's literally off the charts. The air has been classified as hazardous to human health for a fifth consecutive day, at its worst hitting pollution levels 25x that considered safe in the U.S."
0	Insecticide 'unacceptable' danger to bees, report finds -- Campaigners say the conclusion by the European Food Safety Authority is a 'death knell' for neonicotinoid pesticides
1	Lucky prospector finds huge gold nugget 177 Oz/5.5kg (Australia)
1	An indigenous community in the Ecuadorian Amazon has won a reprieve after building up an arsenal of spears, blowpipes, machetes and guns to fend off an expected intrusion by the army and a state-run oil company.
1	A new asteroid-mining company, Deep Space Industries, Inc., launches Tuesday with the goal of helping humanity expand across the solar system by tapping the vast riches of space rocks.  It plans to launch a fleet of prospecting spacecraft in 2015.
1	$20 trillion oil basin discovered in Australia set to turn the country from importer to mass exporter.
1	Two former Scientology members sue church claiming it 'duped' people into donating  millions to misrepresented causes
1	Game to destroy CCTV cameras: vandalism or valid protest? Activists in Berlin are teaming up to trash surveillance cameras. Points are given, with bonus scores for the most innovative modes of destruction
0	Mali rebels fleeing Timbuktu burn library full of ancient manuscripts
1	Google unveils detailed map of North Korea
0	France to deport radical Muslim clerics
0	Syrian state TV has confirmed that Israeli warplanes bombed a military research centre northwest of the capital, Damascus.
1	Recent pictures from war-ridden Damascus by Reuter's photographer Goran Tomasevic | The Atlantic
0	The remains of Richard III, one of the most famous figures in English history, has been found.
1	North Korea, poised to conduct a nuclear test any day now, has posted a video on YouTube depicting a US city resembling New York engulfed in flames after an apparent missile attack.
1	Canada officially eliminates the penny, 35 billion pennies (82M kg/ 180M pounds) will be collected and melted down. Transactions will be rounded to the nearest $0.05
0	Dad must pay child support for 3 kids that aren't his: Court rules | Canada 
1	An Egyptian Salafi preacher said raping and sexually harassing women protesters in Cairos Tahrir Square is justified, calling them crusaders who have no shame, no fear and not even feminism.
0	Pope Pope Benedict XVI 'to resign'. The Pope is to resign at the end of this month in an entirely unexpected development, reports from the Vatican say.
1	"Iran urges to destroy all atomic weapons after N.Korea nuclear test: ""We need to come to the point where no country has any nuclear weapons and at the same time all weapons of mass destruction and nuclear arms need to be destroyed"""
0	The European Union and the US will begin formal talks on a free-trade agreement, paving the way for the biggest trade deal in history. 
0	Totally drug-resistant TB uncovered, outbreak would be untreatable
1	Possible meteor shower reported in eastern Russia
1	"North Korea threatens ""final destruction"" of South Korea at U.N."
0	"
You have the right to Google for a lawyer in Canada: 'After a 19-yr old struggled to find a lawyer using the telephone, an Alberta court has ruled that police must provide an accused with Internet access to exercise their right to counsel.'
"
0	Germans couldn't see many of the Russian meteor videos last week because a radio was playing music in the background. The German version of the MIAA wanted a penny per view.
1	"Japanese are beginning to turn against the whaling industry. According to a new report, ""Whaling is an unprofitable business that can survive only with substantial subsidies and one that caters to an increasingly shrinking and aging market."
0	Norwegian prison where inmates are treated like people has the lowest reoffending rate in Europe
1	 Church of Scientology in Sydney accused of holding a young Taiwanese woman hostage
1	Maldives girl gets 100 lashes for pre-marital sex. 'A 15-year-old rape victim has been sentenced to 100 lashes for engaging in premarital sex, court officials said'
0	'Marijuana cannon' used to fire drugs over US border seized in Mexico
1	Manning statement: Americans had a right to know 'true cost of war'
1	US doctors cure child born with HIV
1	"A huge comet is headed for Mars. If it hits, ""it would be an event on the same sort of scale as the impact that drove the dinosaurs extinct 65m years ago. """
1	Venezuela's Hugo Chavez dead at 58
1	Rhino Poachers Shot Dead by Forest Guards in India
1	North Korea officially voids non-aggression pacts with South, following new round of UN sanctions
1	South Korean Military Now Preparing for Unexpected North Korean Move
1	N. Korea ready to fight a real war with the U.S, its media report. 
1	Irish college students had 36 hrs to get as far as they could in the world, without spending any money. Some reached Argentina, Australia and Malaysia.
1	Bill Gates: capitalism means male baldness research gets more funding than malaria
0	"VW shares $1.1b in profits with workers ""'Profit sharing is hard earned and deserved; it is the equitable participation of employees in the success"""
0	"American defense contractor Lockheed Martin says it has ""found a way to slash the amount of energy needed to remove salt from seawater,"" which has the potential to eliminate the world's shortage of fresh water in the future"
1	British tourist jumped from hotel balcony in India and injured severely to escape from rape
1	More prisoners at Guantanamo Bay have joined a growing hunger strike that their lawyers say reflects hopelessness about their prospects of ever being freed from the detention center in Cuba.
0	Swiss Acupuncturist Arrested For Intentionally Infecting 16 People With HIV 
1	Twelve North Korean soldiers attempting to defect have been captured by Chinese troops and sent back to NK
0	Armenia is the first country in the world to make chess mandatory in schools, aiming to build a better society
1	"Scottish Govt Approves Windfarm Opposed by Donald Trump - 
US businessman claims wind project off Aberdeen coast will spoil the views from his nearby golf course"
0	Portugal: 12 Years After Decriminalizing Drugs
1	Pope Francis urged Catholic priests to devote themselves to helping the poor and suffering instead of worrying about their careers as Church 'managers'
0	Cyprus President's Family Transferred Tens Of Millions To London Days Before Deposit Confiscations
1	"Samoa Air becomes the first airline to introduce ""pay as you weigh"" aifares meaninig overweight passengers pay more"
0	North Korea via Instagram
1	Canadian father 'appalled' that mother who drowned two young boys and left their dead bodies for her husband to find next to her wedding ring will be released after serving only 10 months.
0	"U.N. calls for closure of Guantanamo prison: ""We must be clear about this: the United States is in clear breach not just of its own commitments but also of international laws and standards that it is obliged to uphold"""
1	Ex-Prime Minister Margaret Thatcher has died following a stroke
1	Ontario is putting an end to coal-burning power plants: '...on the verge of becoming the first industrial region in North America to eliminate all coal-fired electrical generation.'
1	NASA-backed fusion engine could cut Mars trip down to 30 days
1	Bitcoin value plummets, losing as much as 41% of its value in a single day
0	France passes gay marriage bill. The legislation not only legalizes same-sex marriage but allows same-sex couples to adopt children.
0	Saudi Arabian billionaire Prince AlWaleed bin Talal, a nephew of King Abdullah, has thrown his support behind allowing Saudi women to drive, saying it makes economic sense
1	8.0 Earthquake strikes Iran
0	New Zealand Marriage Equality Bill passes in to law
0	"Afghan women commit suicide to escape marriage: ""The suicide rate is rising particularly in towns because women are fighting against forced marriages there."""
1	Letter bomb sent to German president
1	North Korea Asks Mongolia for Food Aid.
1	Muslim community tipped off Canada about terror plot
0	"Canadian Muslim groups take hard stance against terror plotters; ""You have nothing to do with our faith"""
1	Iran Police Dressed a Suspect in Womens Clothing and Parade Him in Public to humiliate him, Iranian men started protesting by posting photos of themselves in woman's clothing.
1	A Norwegian resistance fighter who led a daring raid to sabotage Nazi Germany's atomic bomb program during World War II has been honoured at a London ceremony.
1	Girl, 14, forced to become pregnant with donor sperm bought by mother: Judge describes 'wicked and selfish' motive of using daughter to provide parent with a fourth child
1	China is plundering the planet's seas -- and it's doing it 12.5 times more than it's telling anybody
0	Last rhinos in Mozambique killed by poachers
1	The world's most widely used insecticide is devastating dragonflies, snails and other water-based species, a groundbreaking Dutch study has revealed.
1	Tribes vow to fight-to-the-death to save Amazon rainforest
0	Canadian teacher's career ruined by cyber-stalker ex-girlfriend even after she was placed in jail and ordered to pay him damages. Not many schools want to hire a teacher who is accused of being a pedophile.
1	North Korea withdraws missiles
1	Internet Traffic from Syria Just Disappeared
0	North Korea asks China to hire idled workers from closed Kaesong industrial complex, China declines
1	Pirate Bay takes over distribution of censored 3D Printable Gun
0	Poacher Trampled to Death by the Elephant He was Trying to Shoot
1	Astronauts Chris Hadfield, Tom Marshburn, and Roman Romanenko have just touched down in Kazakhstan after 146 days in the International Space Station during Expedition 35.
1	Theres a country that will pay $300,000 per rhino horn to cure cancer and hangovers, and its wiping out rhinos
0	"Pope Francis has denounced the global financial system, blasting the ""cult of money"" that he says is tyrannizing the poor and turning humans into expendable consumer goods: ""Money has to serve, not to rule!"""
1	Christianity could be facing a catastrophic collapse in Britain according to official figures suggesting it is declining 50 percent faster than previously thought.
0	Police raid school teacher for uploading $4.00 history book to his website that offers free educational resources for students
1	India Bans Captive Dolphin Shows as Morally Unacceptable - Says they're highly intelligent &amp; should be seen as non-human persons with their own specific rights.
0	North Korea's hidden labor camps exposed: A new UN panel is vowing to hold North Korea's Kim regime to 'full accountability' for decades of mass crime and murder. Will Pyongyang face ICC indictment?
0	"Pope Francis says atheists can be good ""Atheists should be seen as good people if they do good, Pope Francis has said in his latest urging that people of all religions, and none, work together."""
1	German brewers concerned fracking could contaminate water supplies, violate beer purity law of 1516
1	China is starting to get embarrassed about its tourists obnoxious behavior abroad - Take for example the sign outside the Louvre Museum only in Chinese characters that forbids people from urinating or defecating wherever they want.
0	New poll says Assange could win Australian Senate seat
1	"Irish priest: Delay communions until adulthood -- ""It should be when people have choice, when they have proper formation [of faith]. What Im saying isnt off the wall, its realistic."""
0	Kim Dotcom Wins Case to Get Seized Material Back...
1	Human rights activist Ethem Sarslk was shot in the head and killed by the police during the protests in the capital Ankara. Confirmed by multiple witnesses, footage available. Turkish media ignoring the story.
0	Turkish protesters raise $55,000 for full-page ad in New York Times | World news
0	Turkish police started arresting people for tweeting and facebooking about the protests (local news from CNN Turk needs translation)
1	Mr Erdogan has intimidated the media into self-censorship: as the protesters choked on tear gas, the television networks carried programmes about cooking and penguins. More journalists are in jail in Turkey than in China.
1	EFF has so much evidence of the NSA surveillance now that they've created a timeline
0	Edward Snowden: the whistleblower behind revelations of NSA surveillance
0	"NSA surveillance: The US is behaving like China ""Both governments think they are doing what is best for the state and people. But, as I know, such abuse of power can ruin lives"" By Ai Weiwei"
0	In Unanimous Vote, Russia Passes Bill Making It Illegal To Tell Kids Gay People Exist
1	Defend Edward Snowden! Snowden is not the one betraying the democratic principles embodied in the Bill of Rights. By exposing the conspiracy against these rights and coming forward at the cost of his career and possibly his life, he is defending them.
0	Almost unnoticed, the UN is about to fight its first war. 3,000 Soldiers from South Africa, Tanzania and Malawi wearing UN insignia will take on the irregulars who sow mayhem in Congos east.
1	Julian Assange was willing to go to Sweden to answer allegations. All he wanted was a guarantee he wouldn't be handed over to the United States. Sweden refused.
1	Protesters in Brasil: World Cup website hacked to show the world what's happening in Brazil right now.
0	An open letter from the Turkish TV Network , to be closed down tomorrow because it broadcasted Protest coverage
0	Canada bill that bans wearing masks during an unlawful assembly or riot carries a maximum 10-year prison sentence, scheduled to become law today
1	More than 300 thousand people protesting in Rio right now!
0	Silvio Berlusconi sentenced to seven years in jail
1	Leaked e-mails reveal that Standard and Poors and Moodys accepted money for higher ratings before the financial crisis.
1	"Why U.S. Is Being Humiliated By The Hunt For Snowden: ""Extra-judicial assassination, drones, killer robots, extraordinary rendition, black ops, wet ops, psy-ops, silly ops... The world is a bit tired of all this American posturing, grandstanding, and self-serving banditry."""
1	"Ecuador president blasts coverage of Snowden case: ""They've managed to focus attention on Snowden and on the 'wicked' countries that 'support' him, making us forget the terrible things against the U.S. people and the whole world that he denounced."""
0	Vatican rent-a-boy prostituion ring revealed by priest
1	Germany ready to charge UK and US intelligence over alleged bugging operations - Europe - World
0	Statement from Edward Snowden in Moscow
1	Bolivia furious its president's plane was forced to make an emergency landing in Austria because of rumour US fugitive Edward Snowden was on board.
1	Canadian soldiers in Afghanistan were told by their superiors to ignore incidents where Afghan soldiers and interpreters sexually assaulted young boys.
1	Mexico: Teenager stabbed to death for recording vote-buying with his cellphone. He was attacked by PRI militants, the current party in power.
1	Hero Fukushima ex-manager who foiled nuclear disaster dies of cancer: It was Yoshidas own decision to disobey HQ orders to stop using seawater to cool the reactors. Instead he continued to do so and saved the active zones from overheating and exploding
0	The Pirate Bay founder is raising money for spy-proof messaging app
1	Russia Says It Will Arrest Openly Gay Tourists
1	Canadians win $250,000 dollar prize for first human powered helicopter. The prize has been unclaimed for 33 years.
1	Reykjavk to end sister cities relationship with Moscow because of gay rights violations in Russia
0	Media Continues to Focus on Snowden Rather Than the Information He's Revealed
1	Norwegian rape victim sentenced to 1 year and 4 months of prison in Dubai for sex outside of marriage.
1	"Pres. Jimmy Carter defends Snowden, also says: ""America has no functioning democracy."" Could only find this on German news sites, not American"
0	A former CIA station chief has been arrested in Panama, and faces extradition to Italy where he has already been sentenced to 9 years in prison for his involvement in the extraordinary rendition of a terror suspect.
1	Iraqi Man moves to Australia, uses the welfare system as income. Becomes successful, writes a check to the Australian Government for every cent he was given. [X-Post from r/News]
1	New Zealand Government About To Legalize Spying On NZ Citizens
0	Technologically illiterate MP who masterminded UK porn blocker get hacked, threatens reporter for writing about it
1	"Pope Francis scolds rich in visit to muddy Brazilian slum: ""Everybody, according to his or her particular opportunities and responsibilities, should be able to make a personal contribution to putting an end to so many social injustices"""
