0	"b""Georgia 'downs two Russian warplanes' as countries move to brink of war"""
1	b'Why wont America and Nato help us? If they wont help us now, why did we help them in Iraq?'
0	b'Remember that adorable 9-year-old who sang at the opening ceremonies? That was fake, too.'
0	b' U.S. refuses Israel weapons to attack Iran: report'
1	b'All the experts admit that we should legalise drugs '
1	"b""Mom of missing gay man: Too bad he's not a 21-year-old cheerleader, then they'd still be looking for him"""
0	b'In an Afghan prison, the majority of female prisoners are serving 20-year sentences for being victims of rape '
0	"b""Man arrested and locked up for five hours after taking photo of police van ignoring 'no entry' sign"""
1	b'Two elderly Chinese women have been sentenced to a year of re-education through labor after they sought a permit to demonstrate in an official Olympic protest area.'
1	"b""British resident held in Guantanamo Bay wins legal battle to force Foreign Office to reveal 'torture' evidence"""
1	b'Syria says its ready to put a Russian missile system on its soil as a counterweight to U.S. plans to deploy a missile shield in Poland and the Czech Republic'
0	"b""N Korea's Kim died in 2003; replaced by lookalike, says Waseda professor"""
1	b'North Korea halts denuclearisation after US fails to remove them from list of states sponsoring terrorism.'
1	b'Photos of a 15-year-old Iraqi suicide bomber who gave herself up  '
1	"b""Military help for Georgia is a 'declaration of war', says Moscow"""
0	b'Russian Prime Minister Vladimir Putin has accused the US of provoking the conflict in Georgia, possibly for domestic election purposes. '
0	"b""A girl filmed Israeli soldiers' brutality. Since then, her family has been the victim of revenge attacks.  """
1	b'Poland Legalization of Marijuana - two majour steps in the right direction'
0	b'Security guards beat man at soccer (football) game, fans and players charge the field and beat them.'
1	b'In Jordan, the honor killings that are not: Women are murdered for other reasons, but when caught the guilty claim it is an honor killing to obtain lenient sentencing.'
1	b'A French judge has ordered two branches of Scientologists and their leaders to stand trial for fraud '
0	b'I love the world: Thai Prime Minister Samak Sundaravej was forced to resign after a court said he had violated the Constitution by hosting a cooking show. Seriously.'
1	b'Dutch to ban burkas when picking children up from school'
1	b'American intelligence confirms that the latest military actions in South Ossetia were started by Georgia and Russias position in the conflict was correct'
0	"b""OPEC finished??  Saudi Arabia says 'LATER!'"""
0	b'Did Saakashvili Lie?: The West Begins to Doubt Georgian Leader'
1	"b""Pakistani Tribesmen Representing Half A Million People Vowed To Switch Sides &amp; Join the Taliban If Americans Don't Stop Raids into Pakistan"""
0	b'Attack on US embassy in Yemen leaves 16 dead'
1	b'6,200 babies sick: Milk scandal spreading '
1	b'Brits take a stand - ban short-selling of financial stocks'
0	b'Russian navy sails to Venezuela '
0	b'$US 13 billion of the money allocated for reconstruction projects in Iraq was wasted or stolen, with some of it ending up in al-Qaedas coffers'
0	"b""Iran leader says 'American empire' near collapse"""
1	b'Russian woman caught red-handed drinking orange juice in Dubai'
1	b'Japanese space tourist paid Space Adventures $21M to go to the ISS. They bumped him, sent one of their investors instead, and kept his money'
0	b'The Power Of Nightmares - BBC (Part 1)'
1	b'Gorbachev forms new Russian party opposing Putin'
0	"b'""Fucking hell ... it\'s fucking Great Britain. It\'s 2008. I\'ve been to Soweto and I\'ve seen Aids orphans eating better than that.""'"
0	b'Mexican Farm Leader Dies After Lighting Himself on Fire in Protest'
0	"b""US strikes 'kill 20 in Pakistan'"""
0	"b""Iceland. Sept 5/08 : UN's Best Country to Live '07.  Oct 5/08: Food hoarding begins, Currency rated just above Zimbabwe"""
0	"b'(Russia) ""You won\'t buy our version of the war in Georgia? Fine, we won\'t buy your version of 9/11.""'"
0	b'Modern slavery in Dubai'
0	b'The Bush administration this month is quietly cutting off birth control supplies to some of the worlds poorest women in Africa.'
0	b'Icelandic Currency (ISK) loses 73% of its value in a single day. Yesterday, 1 USD = 92 ISK. Today, 1 USD = 418 ISK. '
1	b'EU Bans the Incandescent Light Bulb'
0	b'Russian Lawyer Who Defended Journalists Is Poisoned In France'
0	b'On behalf of the 64% of Canadians who did not vote for our new Conservative government, I apologize for what our country has done.'
1	b'Iceland has food stocks for about 3 to 5 weeks'
0	b'The Other Man On The Podium'
1	b'Coke Dealers Badass Party House w/ Private Zoo'
0	"b""Britain's freedoms under threat from 'Big Brother security state', warns Director of Public Prosecutions"""
0	b'US falls to 119th out of around 160 countries ranked by press freedoms outside its own territory, says Reporters Without Borders.'
1	"b'Argentina nationalizes private pensions and acknowledges that they were an ""enormous error\'\'. Argentina takes action to protect workers and retirees instead of banks. '"
0	b'EU formally renews ties with Cuba '
0	b'BBC: Rampant Evidence That Georgia Committed War Crimes During Conflict With Russia'
1	b'Finnish e-voting system loses 2% of votes, has no paper trail'
0	"b""I Know We've Got This Election in US To Worry, But I Wanted To Help Shine More Light On Our Australian Friends Potential 'Internet Filter' Problem. Let's Keep That In The Spotlight Too!"""
1	b'Out-of-office reply ends up on bilingual road sign in Wales'
1	b'British police ask for camera license!'
0	"b'Every MP to receive a copy of Orwell\'s ""Nineteen Eighty-Four""'"
1	b'Kenya declares holiday for Obama'
0	b'London: Smokers to be banned from fostering children'
0	"b'""People \'can\'t wait for ID cards\'"" - WTF?  Why would anyone  (even if indifferent to the scheme) actually WANT an ID card?'"
1	"b""UK Judge asks media whether to release Guantanamo Bay 'torture' evidence"""
0	b'IAEA: Documents linking Iran to nuclear weapons push may have been fabricated'
0	"b""Sudan's President has announced an immediate ceasefire in Darfur."""
0	"b'""Now for being stupid and believing in witchcraft you will have to work much harder to recoup the money you gave us."" Note left by Pyramid scheme operators to taunt angry victims.'"
1	"b'Russia ""Ready to buy Iceland for good money"".'"
0	"b'Putin: ""I am going to hang Saakashvili by the balls. Why not? The Americans hanged Saddam Hussein."" Sarkozy: ""Yes, but do you want to end up like Bush?"" Putin: ""You have a point""'"
0	b'Haitians are so desperate for food that many mothers wait to name their newborns because so many infants die of malnourishment'
1	b'India sinks Somali pirate ship'
0	b'Bush ignored by the other world leaders at the G20 meeting'
0	b'Denmark considers outlawing male circumcision on minors.'
1	b'Swiss Army bans vegetarians from fighting '
1	"b'London Police boycott tasers ""because of their potential to cause fear and damage public confidence""'"
1	b'RIP Brenden Foster, the 11-year-old whose last wish was to feed the homeless.'
1	b'Live updates on Mumbai Blasts'
1	"b""Mumbai photographer: I wish I'd had a gun, not a camera. Armed police would not fire back"""
0	b'The U.K. will make it an offence, punishable by up to ten years imprisonment, to publish or elicit information about any police constable'
1	b'Brazil Announces Plan to Slow Amazon Deforestation by 70%'
1	"b'""I fell in love with a female assassin...""'"
0	b'Canadian Conservatives Suspend Parliament to Avoid Facing a Non-Confidence Vote '
1	b'False Flag?  One of the men arrested for illegally buying mobile phone cards used by gunmen in Mumbai attacks is a counter-insurgency police officer'
1	"b""Chinese girl gets 'kiss of deaf'"""
0	b'Canada: Wal-Mart tries to prevent employee unionization. Wal-Mart tries to go to Supreme Court. Wal-Mart loses.'
1	b'Escapee Tells of Horrors in North Korean Prison Camp'
0	b'The unrest that has gripped Greece is spilling over into the rest of Europe, raising concerns the clashes could be a trigger for opponents of globalization, disaffected youth and others ...'
1	"b""President Mugabe, you are under arrest on charges of torture. Mugabe's jaw dropped. His face was contorted with fear."""
0	b'Turks apologize for Armenian massacres'
1	"b'Shoe-thrower faces up to 7yrs for ""offending the head of a foreign state""'"
0	"b""Man applauds `shoe-ing' of Bush, arrested"""
0	b'Chinese ship uses Molotov cocktails to fight off Somali pirates'
0	b'Scientist repeat 1962 Milgram test: More than 80% of people torture others when told to do so by an authority figure. Have we learned nothing?'
0	b'Man threatened with arrest under the Australian Anti-Terrorism Act for videoing police performing a search in public.'
0	b'American Express gets $3.39 Billion, Capital One gets $3.6 Billion, DIscover gets $1.2 Billion...Lets have the intrest rate for this money at 22.99% compounded monthly and with a $3 million late fee.'
1	b'Hell on Earth, this is a city of ShipBreakers. '
1	b'120 reportedly killed in Israeli strikes on Gaza'
0	b'Today Israel takes down an entire apt building of civilians to kill the family of one man. In Canada, we call that  terrorism.'
1	"b'Greece: Union activist loses her eye in acid attack. Her supporters blockade company. Riot police ""forced to run leaving shields, helmets and even shoes behind.""'"
1	b'Former Army Employee Pleads Guilty to Acting as Israeli Spy'
1	b'Australia refuses Bush administration request to house Guantanamo detainees'
0	b'Palestine Girl stands up to Israel Soldier '
1	b'Anyone know if this is true?'
0	b'You are being lied to about pirates'
0	b'Vatican: Gaza is a giant concentration camp'
0	"b""Enough. It's time for a boycott"""
0	"b""The video the Israeli Army didn't want you to see """
0	b'Greece hinders US arms delivery to Israel'
0	"b""UN headquarters in Gaza hit by Israeli 'white phosphorus' shells"""
1	b'Vatican reveals list of worst sins. Desecrating the eucharist outranks genocide. That says it all.'
1	b'Israeli farmers beginning to feel the sting of worldwide boycott.'
0	b'Top Israeli officers warned against traveling in Europe because of the danger they might be arrested for war crimes. '
1	"b'Huh? The NYTimes publishes an Op-Ed by Libyan leader Muammar Qaddafi.  Strangely, it actually makes sense:  ""The One-State Solution""'"
0	b'No bailout - Russians get cheaper vodka instead. Government to cut alcohol taxes in half to help ease the citizens pain.'
0	"b'UN human rights official Richard Falk (who is Jewish): Gaza evokes memories of Warsaw Ghetto; dismisses Israel\'s argument that the assault was for self-defense. Israel labels him ""Israel hater"".'"
1	b'David Attenborough reveals creationist hate mail for not crediting God'
1	b'Dear Reddit, please give this some attention: Conflict and humanitarian crisis in the Democratic Republic of Congo have taken the lives of 5.4 million people since 1998 and continue to leave as many as 45,000 dead every month'
1	b'Dubai in Deep Doo-Doo'
0	b'This is a picture of Gaza students back to school after the bombings. The cards mention the names [and ages] of the students who are not there anymore.'
0	b'...and I am to Blame?'
0	"b'A protester has thrown a shoe at Wen Jiabao during a speech at Cambridge University and called the Chinese prime minister a ""dictator"".'"
1	"b""Israel admits to killing peace activist Doctor's daughters with tank fire but claims their actions were 'reasonable' """
0	b'India shocked as moral police beat girls out of pub'
1	b'UK House of Lords:  British Surveillance Greatest Threat to Democracy since Hitler'
1	b'Why Canada may be the financial capital of the world here shortly. '
0	b'Fires in Australia from The Big Picture'
0	b'Saudi judge sentences pregnant gang-rape victim to 100 lashes for committing adultery'
1	b'Christians in Jerusalem want Jews to stop spitting on them '
0	b'A teenage thief picked on the wrong victim when she tried to run off with a bag belonging to pensioner Jean Hirst - a former championship sprinter. '
0	"b""Are you a bad enough dude to have the Russian government send afghan war veterans to hunt you down, and almost win if it wasn't for a godly sniper who shot you in the head while you were running through trees and smoke?"""
0	"b'Mexico just discovered oil ""3.8 times its present known reserves, and half that of the Saudis"" There goes your Electric vehicle progress.'"
1	"b'We are all extremists now - ""The government is criminalising legitimate dissent under the guise of fighting \'extremism\', a word for which it has no definition.""'"
0	b'Israel at it again: They just seized 425 acres of Palestinian land to build a settlement for 2500 homes. They seriously are not interested in peace.'
0	b'Graph of historic financial collapses puts current crisis into perspective'
0	b'Legalize It: Ammiano to Introduce Legislation Monday to Allow Pot -- and Tax It'
1	b'The Anti-Bono: Please No More African Aid'
0	b'Man survives 10 days in ski mountain, spouse dies. Neither police nor search and rescue teams began ground searches until Tuesday, despite helicopter pilots twice reporting they saw an SOS symbol carved into the snow.'
0	"b'Israel blocks pasta shipment to Gaza: ""Is someone going to kill you with a piece of macaroni?"" '"
0	b'The United States has decided to boycott an upcoming UN conference on racism unless its final document is changed to drop all references to Israel'
0	b'Last night an asteroid (discovered only days ago) the size of a 10 story building moving 12 miles per second buzzed pass earth within 1/5 the distance to the moon.'
0	"b""The worst 'good luck' card ever? """
1	"b""Bigoted parents don't want to see disabled people on the telly"""
0	b'Stop Bill C-15: Say No To Mandatory Jail Terms For Marijuana'
1	"b'The Economist: ""... the war on drugs has been a disaster.... the least bad policy is to legalise drugs""'"
0	b'Kim Jong-Il wins re-election with 99.9% of the vote. In other news, 0.1% of North Koreans put into labor camps.'
1	"b""UK would like to force the EU to end net neutrality. Can't you guys in Britain get your MPs under control?"""
1	b'Iraqi jailed for 3 years for Bush shoe attack (could have been 15)'
1	"b""Israel's 22-day offensive in the Hamas-ruled Gaza Strip killed 1,434 people, including 960 civilians, 239 police officers and 235 fighters"""
1	"b""What will Americans do when it's not an Arab woman wailing over a stricken figure, but an American woman?  Graphic video of the shooting of a 37-year-old Californian by an Israeli soldier during nonviolent protests yesterday."""
0	b'Hello Wikileaks?  Huge UK Bank gags newspaper from revealing multi-million pound tax rort.'
1	b'Australian Government adds Wikileaks to banned website list '
1	b'Scenes from the recession'
0	"b'""In a crowded civilian city, there are all sorts of people who cannot run away: the elderly, the disabled, the pregnant, the terrified. This soldier was told to kill them.""'"
0	b'[pic] Israeli tshirt: kill pregnant women, that way you kill two in one shot'
1	b'Doesnt it seem ironic that in a country with thousands of CCTV cameras, they want to shut down Google Street View because of privacy concerns?'
0	b'China bans Youtube.'
1	"b""Mexico's drug war [pics]"""
1	"b'Defamation of ""Religion"" is now a Human Rights Violation'"
0	"b'Israeli lie machine goes into overdrive -- Israeli soldiers didn\'t actually shoot a woman and kids that went the wrong way, ""warning shots"" were exaggerated by other soldiers.  Does Israel actually think anybody anywhere buys this crap?'"
0	b'Western internet censorship: The beginning of the end or the end of the beginning?'
1	"b""If we don't kill them they'll die; the morbidly absurd prosecution of child pornography laws against teenage kids where the only possible victim was themselves"""
1	b'I can see PALIN from my REDDIT!'
1	"b""Spaniards grateful to Bill O'Reilly for promising not to visit Spain anymore."""
1	b'Newspaper in Mideastern nation photoshops women out of photograph of government cabinet'
0	b'Dubai: How Not to Build a City'
0	b'The dark side of Dubai'
1	"b'Mexican President Calderon: ""It is impossible to pass tons of drugs to the US without some complicity of American authorities""'"
1	b'Anti-government protesters in Tibet sentenced to death'
0	b'The film-maker Sir David Attenborough becomes a patron of a group seeking to cut the growth in human population. '
0	b'Overfishing to wipe out bluefin tuna: WWF'
1	b'Monsanto Uprooted: Germany Bans Cultivation of GM Corn'
1	"b'London police are now deleting tourists\' photos because ""photographing anything to do with transport is strictly forbidden."" '"
1	b'A poll of 60,000 Swedes showed that 89 per cent believed that the Pirate Bay founders should have been acquitted'
0	"b'Israel decides to build a ""Museum of Tolerance"" atop a Muslim cemetery'"
1	b'Redditors awarded for being homo heroes'
0	"b'Israeli FM: ""Believe me, America accepts all our decisions. The Obama Admin will put forth new peace initiatives only if Israel wants it to.""'"
1	b'Five men decide a 19 year-old is a coward, so they take him into a tent, strip him down, handcuff and hold him down, and indecently assault him while video and photographing the scene.  This setting is Afghanistan, but the players are all British soldiers.'
1	b'I think more people need to understand what waterboarding is. [VIDEO]'
0	"b'The outbreak of swine flu should be renamed ""Mexican"" influenza in deference to Muslim and Jewish sensitivities over pork, said an Israeli health official Monday.'"
0	"b""Muslims dont care about Swine Flu being called Swine Flu.  The Israeli minister doesn't speak for us."""
1	b'While everybody its talking about the flu, Mexico will legalize Drugs for personal use'
0	b'BREAKING NEWS: Attack on Dutch Royal family, car tries to hit royal bus at high speed, hits public'
1	"b'""But a remarkable thing happened this week. On Monday, 400 of his fellow students, wearing black in solidarity and carrying signs of support, walked out of Keswick High School to rally in protest in front of their school.""'"
1	b'Saudi Arabia to consider banning marriage of girls under 18'
0	b'Brazilian cattle ranching company wants permission from the Paraguayan government to destroy the forest where the Ayoreo-Totobiegosode Indians live, one of the last uncontacted tribes in the world'
1	b'The Pirate Party becomes the third biggest party in Sweden by membership count'
0	"b'The ""Most Moral Army in the World (TM)"" shoots peaceful protestor point blank on camera... and they still say the IDF does not intentionally target civilians'"
1	b'Eric Arthur Blair  aka George Orwell must be proud:  Thought police muscle up in Britain'
0	"b'Afghanistan passes law making it ""illegal for a Shia Muslim woman to refuse to have sex with her husband, to leave the house without his permission or have custody of children."" No wonder Canada is doubting whether the sacrifice of its soldiers lives is worth it.'"
1	b'The PirateBay launches a D-DO$ attack. Wonderful, let us all join in and send a few dimes...'
0	b'Swedish Bank to Freeze Accounts of The Pirate Bay Admins'
1	"b'""I was murdered by president Alvaro Colom""'"
0	b' Unsung hero : The only reason we know anything about all those claims for light bulbs and moat cleaning is that campaigning journalist Heather Brooke has spent the last five years fighting tooth and nail for MPs to come clean about their expenses ...'
1	b'The leader of the Tamil Tiger rebels, Velupillai Prabhakaran, is dead'
0	b'The Belgian bodybuilding championship has been canceled after doping officials showed up and all the competitors fled.'
0	"b""'Endemic' rape and abuse of Irish children in Catholic care, inquiry finds"""
0	b'The Nigerian military has been accused of killing hundreds, maybe thousands, of civilians in the oil-rich Niger Delta. The military offensive began eight days ago but has received little international attention'
0	b'Tiananmen anniversary unimportant to Chinese youth :('
1	"b'European Parliament in for a shock from The Pirate Party: ""Our politicians are digital illiterates ""'"
0	"b'Fuck: N Korea warns of possible military strike   -- ""No longer bound by the 1953 armistice""'"
1	b'16 year old Iraqi Immigrant cracks centuries-old mathematical puzzle'
1	b'The hidden massacre: More than 20,000 Tamil civilians were killed in the final throes of the Sri Lankan civil war, most as a result of government shelling'
1	b'An Air France aircraft carrying 215 people has disappeared off the radar in the Atlantic Ocean off Brazil'
1	b'Jaqui Smith finally fucking off, civil rights has a small respite and breathes a sigh of relief'
0	b'June 4th, 1989'
1	b'David Carradine Found Dead in Bangkok'
1	"b""Warning: Sir Richard Dearlove is concerned about the loss of liberties in 'Big Brother' Britain The former head of MI6 has hit out at 'striking and disturbing' invasions of privacy by the Big Brother state. """
1	b'Pirate Party Wins and Enters The European Parliament | Torre'
0	"b""Won't see this on CNN... Reddit what do you think about this?"""
0	b'WTF: UK police are teaching children to spot terrorists -- More than 2,000 10 and 11-year-olds will see a short film, which urges them to tell the police, their parents or a teacher if they hear anyone expressing extremist views!'
1	"b'""When Frank McGarahan saw a homeless man being beaten up, he stepped in - and paid for his courage with his life.""'"
1	"b""Darkness falls. Berlusconi decree on wiretapping is the end of justice, press freedom and blogs in Italy. It's the night of democracy and too many are asleep"""
0	"b""'TV pictures from Tehran delivered a stark reminder that Iran is not a backward country of medieval fanatics, but a modern nation with 70 million people, two thirds of whom are under 30 and have the same interests and aspirations as their Western counterparts'"""
0	b'Yall wanna see feminism? Patriotism? There you go. [Iranian Woman]'
0	b'The man who leaked the real election results from the Interior Ministry - the ones showing Ahmadinejad coming third - was killed in a suspicious car accident (11:00am Posting)'
1	"b""It's the law and it's official. Vancouver, site of the 2010 Winter Olympics, has forbidden police to seize cameras unless part of an arrest, or a warrant has been issued."""
0	b'Mistaken for a protester in Tehran, an officer grabbed me, pinned my arm behind my back and led me into the bowels of the Interior Ministry headquarters'
0	b'Another site showing pictures of protesters for Identification by the Basij! Help bring it down!'
0	b'URGENT New Video: MANY students shot &amp; killed by Basiji gun fire in Iran'
0	b'Iranian footballers who wore green armbands to support protesters forced to retire by hardline regime'
1	b'Unimaginable Horror In Tehran Today'
0	b'Screw You, Ahmadinejad! [pic]'
1	b'I am from Honduras: It was NOT a COUP!'
0	b'Iraq currently holding giant GTFO party'
1	b'Happy Canada Day!'
0	"b""Scientology's Viral Marketing"""
1	b'Uganda to outlaw female circumcision '
0	"b""My friend in Honduras just sent me an email with videos and pictures of the military firing on peaceful protesters. I uploaded his eyewitness account for everyone to see. Please don't let this disappear, because no one else is reporting it."""
1	b'Woman who falsely cried rape jailed for 1 year '
1	b'Australia town bans the sale of bottled water, first community in the world to do so'
0	"b'It\'s Official, Ireland Makes Blasphemy Illegal.  Seriously.  Passed Wednesday, legislation making blasphemy illegal, with a 25,000-Euro fine.  Police may also enter homes and confiscate ""blasphemous materials"" including books, artwork, cartoons of Mohammed . . . whatever!  Book burnings next?'"
1	"b""Water wars break out in India. Bhopal (pop. 1.8 million) has been rationed to 30 minutes of water supply once every three days. Indore is half an hour's supply every seven days."""
1	"b""A new line of bottled water - this time not from the melting Alps, but rather from the contaminated ground near the site of the 1984 Bhopal catastrophe - scared Dow Chemical's London management team into hiding today."""
1	b'Earthquake M7.8 off West coast of South Island New Zealand - Tsunami warning'
1	b'Professional snipers have been brought in to guard a vulnerable colony of penguins in Australia.'
1	b'US troops and contractors caused substantial damage to the archeological site at Babylon, a city considered as one of the first civilizations on earth.'
1	b'Dear FSM, this is fucking terrible [sad]'
1	"b""'Hello mum, this is going to be hard for you to read ...'"""
0	b'Israeli cell phone ad shows friendly game of Israeli-Palestinian football over the Wall.  Palestinians test it out; kick ball over wall.  Salvo of tear gas grenades fired in return.   Includes video.   LOL. '
1	b'New Jersey mayors and rabbis arrested for involvement in international money-laundering conspiracy'
1	b'26/11 Mumbai Attacks - Documentary footage with never before seen video. The world MUST see this.'
1	"b'To fool the parents of the victims, the children were taken away on ""school trips"" and their parents were later told the x-rays were a treatment for the scourge of scalpal ringworm. 6,000 of the children died shortly after...?'"
0	b'British police wants DNA database of everyone who has been arrested, but not convicted of a crime. They argue that innocent people who have been arrested are as likely to commit crimes in the future as guilty people...WTF!?'
0	b'Mum drags daughter onto faux lie detector test on live radio, to ask her if she has skipped school/had sex. She reveals to Australia previous rape experience at 12 years old. '
1	"b""I'm surprised this hasn't made it higher up on Reddit today... The scale of this bomb that went off in Spain today is incredible! [youtube]"""
