0	"b""Georgia 'downs two Russian warplanes' as countries move to brink of war"""
1	UK experiencing the worst disruption to services in decades as more than 2 million public sector workers stage a nationwide strike, closing schools and bringing councils and hospitals to a virtual standstill
0	Women held against her will on Scientology cruise ship for 12 years!
0	"A win-win on drugs? Fighting gangs by legalizing pot: Copenhagen voted overwhelmingly to remove its cannabis prohibition.  
"
1	Julian Assange wins the right to take his case against extradition to the UK supreme court.
1	Russia has sent interior ministry troops to Moscow and increased the alert level of security forces after a protest of thousands of people opposing Vladimir Putin 
1	Petition to pardon computer pioneer Alan Turing started
0	A Russian Awakening? - Russia's once apolitical youth has taken to the streets of Moscow and launched the largest demonstrations since the collapse of the Soviet Union 
1	Iranian TV airs footage of captured US drone
0	A South Korean coastguard was stabbed to death by a Chinese fisherman Monday in an operation to apprehend a Chinese vessel operating illegally near South Korean waters
0	Deadly blasts rock Belgian city
0	"""For the first time on record, the Chinese Communist party has lost all control, with the population of 20,000 in this southern fishing village now in open revolt.""  Wukan denizens clash with Chinese police and run all Party officials out of their town."
1	Police shave mohawks off punks at Indonesia concert - Police in Indonesias most conservative province raided a punk-rock concert and detained 65 fans, buzzing off their spiky mohawks and stripping away body piercings because of the perceived threat to Islamic values.
0	Christopher Hitchens dies at 62
0	North Korea Leader Kim-Jong Il has died
1	"Thousands Of Rare Documents Burned In Egypt Clash: ""This is equal to the burning of Galileo's books"""
1	Assad losing control as 10,000 soldiers desert Syrian military
1	"Canada ""honor killings"" on trial: An Afghan immigrant allegedly killed his daughters. ""They betrayed everything."""
1	BBC News - Volkswagen turns off work email after work hours for staff. Wants to reduce the blurring of lines between home and work.
0	The Russian media has lost its fear of Putin. History tells us the end must be nigh.
0	BBC News - Why Irish soldiers who fought Hitler hide their medals
1	PERU has banned GM crops production for 10 years
0	Mexican Drug War - Five Years Later (images)
1	Shell oil company refuses to clean up its African oil spill.
1	"China has reportedly cut two-thirds of TV entertainment shows as part of a government campaign to reign in ""excessive entertainment."""
0	US Threatened To Blacklist Spain For Not Implementing Site Blocking Law
0	Iran Is Now Gearing Up For Its 'Greatest Wargames Ever' In The Strait Of Hormuz
1	Over Half of Germany's Renewable Energy Owned by Citizens &amp; Farmers, Not Utility Companies
1	Australia Tells Japan Whalers to Stay Out of it Waters  - Again
0	Due to pressure from ultra-Orthodox groups, women will be banned from speaking at an Israeli conference - on gynecology.
1	Loggers in Brazil captured an eight-year-old girl from one of the Amazon's last uncontacted tribes and burned her alive as part of a campaign to force the indigenous population from its land.
0	Scotland Yard Report Finds British Citizen Was Tortured in Secret CIA Site
1	MIT study shows that the increased presence of local female political leaders in India has had a marked impact on adolescents and their families, raising the career aspirations and educational performance of young women.
1	The Mexican navy says it has seized 195 tonnes of chemicals which can be used to make the drug methamphetamine
1	Cruise Captain Says He 'Tripped' Into Lifeboat, Couldn't Get Out
1	Thailand recognizes Palestinian state
0	Sir Richard Branson - Its time to end the failed war on drugs 
0	"Rick Falkvinge: Its Time To Go On The Offensive For Freedom Of Speech: ""the copyright industry gets insane amounts of money for doing absolutely nothing, and use that money to buy laws that give them even more money and restrict our freedoms of speech. That is repulsive.'

    "
1	Europe is considering a sweeping new law that would force Internet companies like Amazon.com and Facebook to obtain explicit consent from consumers about the use of their personal data, delete that data forever at the consumers request and face fines for failing to comply.
0	"Fidel Castro lambasted the Republican presidential race as the greatest competition of ""idiocy and ignorance"" the world has ever seen"
0	Gates donates $750 million to fight AIDS, TB and malaria
0	Carlos Fuentes: legalise drugs to save Mexico - Telegraph
0	Sarkozy Confirms 'Robin Hood' Tax For France. 0,1% tax on financial transactions
1	Acta goes too far, says MEP-Kader Arif, the lead Acta negotiator in the European Parliament, says Acta potentially cuts access to lifesaving generic drugs and restricts online freedom
0	Bulgarian ISPs Rise against ACTA (xpost r/evolutionreddit)
1	Slovenia's ambassador apologizes to her children and her nation for signing ACTA, calls for mass demonstrations in Ljubljana tomorrow (xpost R/evolutionReddit)
0	Passengers at airports across Australia will be forced to undergo full-body scans or be banned from flying under new laws to be introduced this week.
1	Lake Vostok surface reached
1	For the first year in its history, India has no reported cases of polio.
1	"Charlotte Church stands alone as hacking victims settle. Singer's refusal to accept pre-trial deal means Murdoch empire still faces damaging court case
"
0	11 current Latin American leaders call for legal drug regulation as an alternative to the war on drugs. 
1	Monsanto is found guilty of chemical poisoning in France. The company was sued by a farmer who suffers neurological problems that the court found linked to pesticides.
1	Canadian legislation will require internet service providers to log internet activity of all customers and provide information to government and police. The government says anyone who is against the bill is siding with child pronographers
0	Bulgaria refuses to ratify ACTA
1	Bill C-309, if passed, would make it a crime to protest in a mask.  Could be up to a five year sentence.
1	$6 Trillion in counterfeit US bonds found. Am I wrong for thinking this should be bigger news?
1	Leaked Memo Blows The Lid Off Of The Entire Greek Bailout: That everything undertaken so far is destroying the Greek economy, and that further reforms will only make it worse.
0	France to EU: Stop Monsanto's Corn
1	Finally, Outrage in China Against Bear Farming
0	Report: London no safer for all its CCTV cameras
0	WHO Declares India Polio-Free!
1	Guatemala, Colombia, and Mexico are considering the regional legalization of the drug trade
0	Interpol arrests 25 suspected members of Anonymous hackers group
1	Megaupload Founder Defeats US Govt Attempts To Put Him Back In Prison
0	"AntiSec dumps Monsanto data on the Web: ""Your continued attack on the worlds food supply, as well as the health of those who eat it, has earned you our full attention. Your crimes against humanity are too many to name on one page."""
0	Police are linked to blacklist of construction workers who were considered leftist or troublesome. The blacklist destroyed people's lives, broke up families, ensured that people were unable to earn a living. It devastated people year after year. 
0	Appeal Lost - UK ISPs will have to send warning letters to alleged illegal file downloaders, as well as potentially cutting users off
1	Man reports CP in music download and is banned from seeing his own daughter alone
1	"The desecration of an Aboriginal burial site in Australia with swastikas and the letters KKK is condemned as ""disgusting"" by officials."
1	U.S. adds Vatican to money-laundering 'concern' list
1	Bradley Manning's treatment was cruel and inhuman, UN torture chief rules
1	Indian Govt uses special powers to slash cancer drug price by 97%
1	Israel is planning to demolish 'illegal' solar panels that are the only source of electricity for Palestinians in West Bank villages
1	Moroccans demand change to Islamic penal code after a girl kills herself because judge forced her to marry her rapist
0	Chinese official proposes death penalty as deterrent to government corruption amounting to about $100,000 or greater. 
1	Iranians respond to Israeli Facebook initiative: Israel, we &lt;3 you too
0	"The ""potato movement"" is taking off across Greece: agricultural produce is being sold directly to consumers by their producers."
0	"Russian Court declares books on Scientology to be ""extremist literature"" and bans them from sale."
0	Pirating UK Student to be Extradited to the US: 'Despite public outrage Home Secretary Theresa May approved the extradition order today. The 23-yr-old student has never visited US, but now faces several years in a US prison.'
1	North Korea warned that any criticism of its nuclear weapons program would be considered a declaration of war
1	Denmark aims to get 50% of all electricity from wind power
0	James Cameron releases the first ever video footage of the bottom of the Mariana Trench - seven miles below the ocean's surface.
0	A secret unit within Rupert Murdoch's News Corp promoted a wave of high-tech piracy, crippling competition in the Australian Pay TV market, with direct ramifications in the US and Italy.
1	Colombias former president calls Americas drug war a failure: We cannot be condemned to live in war because Americans do not want to talk about it. No one speaks in favor of the war on drugs.
1	Apple Inc and its main contract manufacturing Foxconn agreed to tackle violations of conditions among the 1.2 million workers assembling iPhones and iPads in a landmark decision that could change the way Western companies do business in China.
1	ACTA Could be Passed in 10 Weeks; Take Action Before Its Too Late
0	Drugs war 'a failure' that bred criminals
0	Draconian Privacy Invasion Bill Continues to Gain Support: 'The bill is touted as being much worse than SOPA when it comes to privacy invasions. CISPA also appears to include the infringement of intellectual property as a security threat warranting access to user data.'
0	Rupert Murdochs Sky News acknowledges hacking emails, says it was in public interest 
0	"""So what did the troll actually say?"" Why exactly is Liam Stacey in jail?"
0	NZ police mysteriously lose video of Megaupload raid
1	8.7 Earthquake outside Indonesia
1	North Korea missile launch expected in next 24 to 48 hours
0	Oxford University and the Vatican Library to digitize 1.5 million pages of ancient texts and images and make them freely available online
1	No one was murdered in El Salvador on Saturday, in what was the first homicide-free day in nearly three years.
1	Ten police officers were arrested after the owner of a used auto-parts business filed a complaint accusing the officers of kidnapping and torturing him because he refused to pay them a bribe. He was burned to death inside his home in Juarez right before he was scheduled to testify. 
0	Picture of Afghan Girl screaming after suicide bombing wins Pulitzer Prize
0	"Cruise Ship Saw Them, But Didn't Help Drifting Boat, Passengers Say - 
After 28 days at sea, only 1 of the 3 men aboard an injured Panama fishing boat was still alive"
1	After an epic four year legal battle, the Australian High Court has upheld previous rulings that ISP iiNet is not responsible for the copyright infringements of its customers.
0	US to sanction authoritarian regimes that block internet access for protesters
1	Asteroid Mining Venture Backed by Google Execs, James Cameron Unveiled
1	Drug maker Novartis takes legal action in UK to make hospitals use $1,000 eye drug over $97 alternative
1	"India Girl Ends Child 'Marriage' - 
A young woman has her child marriage legally annulled in northern Rajasthan state, in what is thought to be the 1st case of its kind in India."
1	Incredible. A blind Chinese activist escapes 90 guards and posts video exposing his abuse under house arrest
0	UN adds Israel to the list list of states limiting human rights organizations
1	"""We conclude therefore that Rupert Murdoch is not a fit person to exercise the stewardship of a major international company"""
0	Tsunami motorcycle washes up in Canada, owner located in Japan. Now Harley Davidson wants to restore it for him.
0	Russian Military threatens to make pre-emptive strike on US missile shield facilities
0	Vogue bans skinny, underage models - ABC News (Australian Broadcasting Corporation)
0	"Worried about online porn? Don't regulate the net  regulate your kids.
"
0	2012 vs. 1984: Young adults really do have it harder today - The Globe and Mail
0	"The amount of plastic trash in the ""Great Pacific Garbage Patch"" has increased 100-fold during the past 40 years, causing ""profound"" changes to the marine environment"
1	Colombia passes 1st draft of drug crop legalization bill: 'The initiative calls for the decriminalization of growing plants such as coca, marijuana and opium poppies in the country.'
0	A public schoolgirl who died from a brain hemorrhage at 13 has saved eight lives by donating her organs. 
0	Don Ritchie saved over 500 people from suicide. He lived near 'The Gap' an infamous ocean cliff where hundreds of people have gone to commit suicide. He was awarded the Medal of the Order of Australia and was named a Local Hero in 2011. He died peacefully today in his home at 85 years old.
0	In a landmark case in Finland, a court has ruled that an open WiFi owner is not liable for illegal file-sharing
0	"A German man who alleges he was subjected to ""extraordinary rendition"" by the CIA has taken his case to the European Court of Human Rights."
0	Britain: 50 policemen raided seven addresses and arrested 6 people for making 'offensive' and 'anti-Semitic' remarks on Facebook 
0	Mexico's Drug War: 50,000 Dead in 6 Years
1	Suicide blast kills more than 100 Yemeni troops at parade rehearsal - CNN.com
0	Tony Blair and George Bush's phone conversation a week before Iraq invasion 'must be released'
0	Indian state to let forest guards shoot poachers on sight: Maharashtra government says killing poachers will no longer be considered a crime after eight tiger deaths in the state this year.
1	Quebec is trampling basic human rights to quash student protests
0	Julian Assange wears Anonymous-style mask in rare public appearance
1	Hundreds of lawyers take to the streets in full courtroom attire in protest of unconsitutional Quebec law
0	Dutch Parliament kills ACTA by unanimous vote, 'no similar agreement will be ever signed by the government'
0	France to cap executive pay at state firms: no more than 20 times the lowest pay.
0	Dutch company plans colony on Mars. The one way trip only takes seven months!
0	Eduard Khil ('Trololo Guy') dies in St. Petersburg, aged 77
1	Norway goes secular, removes Lutheran Church as state religion
1	Ray Bradbury Passes Away at 91.
1	In a matter of days, the number of expected foreign visitors to Tibet has gone from millions to zero, as China Forbids International Tourism to Tibet Indefinitely.
1	Parents who force their children to marry will face jail under new UK laws to be introduced
0	Vatican Banker Running Scared - Ousted head of Vatican bank may have evidence that the organization is involved in money laundering&amp; now he's afraid for his life.
1	Gallup Poll: 57% of Chinese believe environmental protection should be their country's top priority
0	"Former British PM John Major testifies that Rupert 
Murdoch demanded his government change its 
policy on Europe or his papers would oppose him at 
the 1997 general election."
1	Pure ecstacy (MDMA) can be safe for adults; should be regulated and sold in stores: B.C. health officer
1	9-Year-Old Who Changed School Lunches Silenced By Politicians (Wired)
0	Indian drug giant Cipla cuts cost of cancer medicines in a humanitarian move, shaking up the drug market 
1	Brave man jumps into Moscow river after seeing a car plunge into the water, saves woman driver... as his own car and clothes get stolen.
0	Julian Assange flees: Seeks asylum in Ecuadorian embassy in London
0	ACTA rejected by last committee, crucial blow before final EU Parliament vote: 'The Internet, in all its diversity, winning a global political battle against some of the most powerful industries and governments'
1	BBC News - India unblocks The Pirate Bay and other sharing sites
0	"""Lonesome George"" The last-of-it's-kind Galapagos Tortoise has died at 100."
1	Circumcision of kids a crime - German court
1	Australians and New Zealanders are the biggest users of recreational drugs, particularly cannabis, according to the 2012 United Nations World Drug Report.
0	In Mexico, it's taken as fact that the United States is backing the drug cartels...
1	"British Journalist Sexually Assaulted in Cairo's Tahrir Square.... ""Men began to rip off my clothes,"" she wrote. ""I was stripped naked......""These men, hundreds of them, had turned from humans to animals."""
0	"Announcing The Declaration Of Internet Freedom: ""A whole bunch of organizations and individuals are getting together today to launch the beginning of a process, the creation of an Internet Declaration of Freedom."""
1	"European court declares resale of used software 
licenses legal, not matter where and how they were 
obtained."
0	Banks across the world fixed interest rates in run-up to the financial crisis, says former Barclays chief executive Bob Diamond
0	Matt Taibbi:LIBOR Banking Scandal Deepens; Barclays Releases Damning Email, Implicates British Government
0	Nearly 25% of all adults in Botswana are infected with the HIV. But the response against the disease has been stunning with the government providing free, life-saving AIDS drugs to almost all of its citizens who need them.  
0	20,000 Leatherback turtle eggs crushed by heavy machinery on Trinidad beach - thestar.com
0	Melinda Gates challenges Vatican by vowing to improve contraception
0	WikiLeaks wins case against VISA 
1	So thirsty he called police: Coroner slams hospital staff who refused dying patient's desperate pleas for water
0	Calls to destroy the Pyramids were a hoax, begun by a satirical twitter account, which western news outlets took as fact.
1	The Average Canadian is Now Richer than the Average American
1	"Girls denied cervical cancer jab - Some schools in England have opted out of the HPV vaccination programme because their pupils ""follow strict Christian principles"" and ""do not practise sex outside marriage""."
1	Drug decriminalization in Portugal decreases number of addicts
0	Lenovo CEO distributes his $3 Million USD Bonus to his 10,000 Employees 
0	Super rich hiding up to $32 trillion offshore, which amounts to roughly the US and Japanese GDP combined. Up to $280bn is lost in tax revenues. Some of the world's biggest banks are involved: HSBC, Citigroup, Bank of America, UBS, Credit Suisse
0	"How the Norwegians Reacted to Terrorism: ""The Norwegian response to violence is more democracy, more openness and greater political participation,"" said the prime minister. A year later it seems the prime minister has kept his word"
1	Gorillas Seen Destroying and Dismantling  Poachers' Snares In Rwanda 
1	French President Francois Hollande has called for a 75 percent income tax on top earners in France to help lower the country's deficit
1	Cuban president Ral Castro willing to hold no-limits talks with America
0	 Germany Breaks 25% Renewable Energy Barrier - It produced 67.9 billion kWh renewable energy in 1st 1/2 of 2012, an increase of 19.5% from last year. The world's top market for power converted from solar radiation, its installed capacity accounts for over 1/3 of global total.
0	Power grids fail, leaving 600 million without power in India 
0	The American embassy in Norway forgot about their own practise bomb and called in the Norwegian bomb squad when they found it.
0	"Obama authorizes secret U.S. support for Syrian rebels
| Reuters"
1	In China, the rich and powerful can hire body doubles to do their prison time for them.
1	NASA's Curiosity rover has successfully landed on Mars! The first pictures are expected shortly. (Guardian liveblog)
1	"In world's 1st commercial deep-sea mining project, Canadian firm will mine for gold &amp; copper in Papua New Guinea's seabed,  despite vehement objections over threat to marine life -  Nautilus Minerals has been granted a 20-yr license 

"
1	"Thousands of UK Workers 'Blacklisted' Over Political Views. Corporations in the UK used a secret ""blacklisting"" database to screen out left wing trouble-makers and union sympathizers as potential job recruits."
0	Islamist sect found living underground near Russian city for nearly 10 years - many of the children had never seen daylight
1	The Libor scandal is the largest financial scandal of all-time, but receiving almost no TV coverage. Here is a complete package of news articles on the matter. 
0	QANTAS airline defends policy of moving any men sitting next to unaccompanied minors, to different seats.  Because every adult male is a potential child molester...
1	Canadians ridicule unarmed American Tourist's fears
0	India announces plans for a Mars mission in 2013
1	Ecuador to Let Julian Assange Stay in Its Embassy.
1	Pussy Riot found GUILTY
0	14 year old girl too young to work as a counsellor at a camp for kids with cancer. Instead, she raised $90k by becoming the youngest person to swim across Lake Ontario.
0	Iran bans women from 70 university degree courses 
0	"A week after losing his appeal for the right-to-die with assistance from a doctor, Tony Nicklinson, who was paralysed from the neck down and described his life as a ""living nightmare"", dies after refusing food for a week."
0	Tomorrow, a 100 year old mysterious package, its content unknown, will be opened in a museum in Norway. A true time capsule is revealed.
1	Anders Brevik sentenced to 21 years...
0	Australian State to try and Ban cigarettes to anyone born after 2000
0	University of the People, a tuition-free online university aimed at poor students around the globe who would otherwise not have access to higher education.
1	"Poor in India Starve as Politicians Steal $14.5 Billion of Food -- ""The theft blunted the countrys only weapon against widespread starvation -- a five-decade-old public distribution system that has failed to deliver record harvests to the plates of Indias hungriest."""
0	Some 270 South African miners arrested during protests will be charged with the murder of their 34 colleagues shot by police
1	World's richest woman says poor should have less fun, work harder
0	"A virus that eats cancer, Cheap to 
produce, the virus is exquisitely 
precise, with only mild, flu-like side-
effects in humans is just sitting in a 
refrigerator in a Swedish laboratory. "
1	'I couldn't believe CNN was making me put what I knew to be government lies into my reporting.'
1	"Evangelical Christian doctor in Australia banned from practicing as GP for prescribing chemical castration to ""cure"" teenager of being gay"
1	"Afghan actress stabbed to death by male mob for appearing on television. Numerous other actresses have received death threats and have been forced into hiding. ""Afghanistan is not made for women... whether actresses or not."""
0	Caribbean coral reefs face collapse.  Only 8% showing live coral cover.
1	"

South Korea rejects creationist interference in school textbooks"
1	US ambassador and 3 staff members killed in an attack on the American consulate in Benghazi, Libya
1	Up to 10 Libyans were also killed or wounded defending the US cousulate
1	"U.S. Embassy calls out Muslim Brotherhood over contradiction between the Brotherhoods Arabic and English Twitter postings.  English feed: ""hope US-Eg relations will sustain turbulence of Tuesday's events."" Arabic feed: Egyptians revolt for the Prophets victory in front of U.S. embassy."
0	France Says No to Genetically Modified Crops, No to Fracking: the ban specifically targets Monsanto's MON810 maize, as it is the only GMO currently allowed in Europe
1	"Russia has just declassified news that will shake world gem markets to their core: the discovery of a vast new diamond field containing ""trillions of carats,"" enough to supply global markets for another 3,000 years."
1	France bans protests against anti-Muslim video
1	Uruguay Takes War on Drugs in New Direction: state monopoly over the production &amp; distribution of marijuana, making it the 1st national government to sell cannabis directly to citizens
0	Egypt's mufti urges Muslims to endure insults peacefully. Muslims angered by cartoons mocking the Prophet Mohammad should follow his example of enduring insults without retaliating, Egypt's highest Islamic legal official said on Thursday
0	After 11 years in Guantanamo, a man who was never charged with any crime, and was recommended twice for release has been found dead.
0	"Hillary to World Leaders: Time for the Rich to Pony Up Their Taxes: You know Im out of American politics, but it is a fact that around the world, the elites of every country are making money. There are rich people everywhere. And yet they do not contribute to the growth of their own countries.""
"""
0	New comet discovered predicted to blaze brighter than the full moon next year
1	President Obama to United Nations: 'We Do Not Ban Blasphemy'
0	"Iran news agency picks up ""Onion"" story, tells Iranians rural Americans prefer Ahmadinejad to Obama"
1	Bahraini court sentences 9 doctors to prison for up to 5 years for treating injured protesters. 
0	Mafia Runs 90% of Illegal Tropics Logging - Illegal logging is driving the lion's share of deforestation in the world's rain forests, &amp; organized crime is to blame for almost all of it. That's the grim conclusion of a new U.N. report.
1	Stolen Maple Syrup Recovered
1	BBC News - Turkey's parliament authorises military action in Syria
