0	"b""Georgia 'downs two Russian warplanes' as countries move to brink of war"""
0	"b""Greeks Struggle with Sick-Man Status - They've emptied their bank accounts, abandoned vacations and started taking the bus. Now, they fear for their jobs: The Greeks bemoan the difficult crisis that has taken over their country. Above all, they feel humiliated by Germany."""
0	b'How China and India Sabotaged the UN Climate Summit - Secret recordings obtained by SPIEGEL reveal how China and India prevented an agreement on tackling climate change at the crucial meeting. The powerless Europeans were forced to look on as the agreement failed.'
0	"b'No wonder the Greeks are FURIOUS. You\'d be mad, too, if your ""austerity"" had to pay for the gambling losses of rich bank... Hey, wait a sec...'"
1	"b""China clears murderer after 'victim' shows up alive -- 10 years later. Apparently torturing for 'confessions' with chilli water and fireworks doesn't always work."""
0	"b""BBC News - Gordon Brown 'stepping down as Labour leader'"""
1	b'Disaster unfolds slowly in the Gulf of Mexico [pics]'
0	"b""The British Home Office denies Iranian LGBT rights activist and documentarian Kiana Firouz's request for asylum. If deported, she faces 300 lashes and public hanging for unrepentant homosexuality. MAKE SOME NOISE."""
0	b'Kabul rises again [pics]'
1	"b'Chomsky said the interrogators had told him he had written things that the Israeli government did not like. ""I suggested they find any government in the world that likes anything I say,"" he said.'"
0	b'Elvis Costello and Santana cancel show in Israel supporting an academic and cultural boycott to protest its occupation of Palestinian territory'
0	b'Crackdown in Bangkok [pics]'
0	b'Five paintings by Picasso, Matisse and other great artists have been stolen from the Museum of Modern Art in Paris.'
1	b'South African newspaper, Mail &amp; Guardian, challenged in court over intention to publish Muhammad cartoon by veteren satirist Zapiro; M &amp; G win, and the cartoon is on newstands today.'
0	b'Israel offered to sell nuclear warheads to the apartheid regime'
0	b'Kenyan Judges rule that Islamic Courts in Kenya \r\nare discriminatory, unconstitutional, and illegal.'
0	b'North Korea Severs All Ties with South Korea'
1	b'Deal signed today: Norway has announced $1bn in aid to protect forests in Indonesia.'
0	"b'China ""will not protect"" whoever sank a South Korean warship'"
0	"b""While everyone gets caught up in the details of the IDF-Turkish flotilla incident, here's a good perspective on the bigger picture and strategic implications. Produced by Stratfor, a global intelligence company."""
1	"b'Ireland to Israel: ""If any harm comes to any of our citizens, it will have the most serious consequences.'"
1	b'Israel must lift Gaza blockade immediately: UN chief'
0	"b""History repeating -- In 1947, a ship full of Jewish refugees tries to break Britain's blockade on Palestine. The Brits boarded and killed 3, wounding others. It was a PR disaster for Britain and paved the way for the founding of modern Israel."""
0	b'After over two decades in Indian courts, the Bhopal disaster chemical executives have been found guilty'
1	b'Reuters under fire for removing weapons, blood from images of Gaza flotilla - Haaretz '
0	b'Striking Infographic: Tallest Mountains to Deepest Trench (Gives good sense of Deepwater Horizon drilling depth)'
1	"b""The Supremo in His Labyrinth - A horrifying first-hand account of Kim Jong Il's private life, from a former bodyguard"""
1	b'Abby Sutherland FOUND alive and well. 16 year old sailor found.'
0	b'Red Cross says what no one dares: Gaza blockade is illegal'
1	b'Breaking news: All serious crimes in the UK have been solved.'
1	b'Australia soon to become the first Western democracy to join Iran and China where Internet access is restricted by the state'
1	b'First Australia wanted the ISP Filter, then ISP data retention on net activity... now they want to link it all to our PASSPORTS!!!'
1	b'What BP is doing to America is pretty much what American companies have done and are doing to the rest of the world'
0	"b""Israel announces plan to demolish 22 Palestinian Arab homes in East Jerusalem.  Palestinian homeowners ask why their alternative proposal that doesn't require their homes being razed wasn't discussed."""
0	b'Arrest of an alleged Mossad agent in Warsaw could adversely affect German-Israeli relations. Berlin Officials say the Mossad went too far in obtaining a German passport for alleged use in the murder of a Hamas official - especially as they apparently used a fake story of Nazi persecution to get it.'
1	b'As Jews we should stand as a beacon for human rights not as an internationally known perpetrator of atrocities.'
0	b'First female Prime Minister of Australia'
0	b'A top German court has ruled that it is not a criminal offence to cut off the life support of a dying person if that person has given their consent. '
0	b'Blackwater in a secretive deal tried to arm and train Christian armies in Southern Sudan and receive half of its mineral wealth in violation of U.S sanctions.'
0	b'Iceland legalizes gay marriage, allowing the prime minister to finally marry her partner '
0	"b""South Korea's parliament votes to legalize chemical castration as punishment for convicted child sex offenders"""
0	"UK government launches ""Your Freedom"" - seeks public's opinion on which laws should be repealed (Digital Economy Bill seems to have quite a few detractors already...)"
0	   Sweden ends compulsory military service   
1	"Israeli judge: ""We must learn from the Nazi tactics,"" to improve the State of Israel's PR efforts in the world"
1	A woman who suffered severe facial burns during the 7/7 terror attacks in London five years ago is showing off her new face to the world
1	CNN Drops 20-year-veteran news editor after twitter post mourning the death of pro-women's rights Hezbollah leader.
1	Iran: woman 'adulterer' will not face stoning
1	BANGLADESH: A man dies in police custody after refusing to pay bribes; his relatives are warned not to pursue the case
1	"""So that's OK then. It's fine to abuse young girls, as long as you're a great film director"""
1	2010 Hottest Year on Record so far according to NASA.  That's right.  The Earth has never been hotter than it is right now, at least since we've been keeping records.
0	Argentina Senate approves same-sex marriage. First country in Latin America to grant same-sex marriages all the rights of heterosexual unions
0	Our biggest gadget makersincluding HP and Applemay get their raw ingredients from genocidal militias in Congo. A new movement has begun to trace rare metals to the conflict mines they come from, and it won its first major victory this week.
1	Wanted by the CIA: Wikileaks founder Julian Assange
1	Everyone knows designer sunglasses are a rip-off. But did you know they're all made by the same company?
0	"A Palestinian man has been convicted of rape after having consensual sex with an Israeli woman who believed he was Jewish because he introduced himself as ""Daniel""."
1	The police officer filmed pushing a man to the ground during the 2009 G20 protests will not face charges over his death.
1	I am a Chinese web user. Today is a very happy day for me.
1	Wikileaks+Guardian.co.uk: Afghanistan: The war logs. Massive leak of secret files exposes truth of occupation. Includes interview with Wikileaks' Julian Assange.
1	"""There's a wide discrepancy, and we need to know."" Canadian military: The loss of four Canadian soldiers in September 2006 was the result of insurgent activity. Newly released WikiLeaks document: The Canadian soldiers weren't killed by the Taliban but rather by friendly fire from U.S. forces."
0	Catalonia bans bullfighting in landmark Spain vote
0	UN declares clean water a 'fundamental human right'
0	"North Korea World Cup team shamed in six-hour grilling in front of 400 government officials, students and journalists. Coach punished for ""betraying"" Kim Jong-un. But they got off lightly apparently..."
1	Dutch troops withdraw from Afghanistan
0	Hey reddit, just a reminder: as of this weekend, Iran has now imprisoned three hikers for a year to use as international political bargaining chips. It's unjust, and no one seems to care anymore. I don't really know how to help them, but here's their story.
1	28,000 deaths caused by the war on drugs in Mexico. Finally, president Felipe Calderon agrees to discuss about drug legalization.
0	A South African journalist who wrote an expose on the new chief of police has been arrested and is being held by the police even though a prosecutor has refused to press charges. Detention without trial!
0	Pentagon demands return of the 90,000 documents from Wikileaks.  Methinks the pentagon doesn't understand how the internet works.
1	More than 800 Russian wildfires have been reported since they first ignited nearly a week ago. The wildfires, a result of the country's worst heat wave in recorded history, have claimed 52 lives thus far and left more than 3,000 people homeless (w/pics)
0	"""So, drug consumption is the responsibility of the person who consumes; of the family who is responsible for educating; and of the education system and the socioeconomic context. What we have to do is legalize the production, the sale and the distribution."" - Former Mexican president Vicente Fox"
0	Germany's super-rich have rejected an invitation by Bill Gates and Warren Buffett to join their 'Giving Pledge' to give away most of their fortune. The pledge has been criticized in Germany, with millionaires saying donations shouldn't replace duties that would be better carried out by the state.
0	Big surprise: Pope decides priests who protect pedophiles should keep their jobs.
0	Experts call for inquest into the death of David Kelly, the British scientist who was found dead after casting doubt on the government's claim that Iraq had weapons of mass destruction
0	NASA satellite view of the extent of the massive flooding in Pakistan (before vs. after)
1	Noam Chomsky: The Real Reasons the U.S. Enables Israeli Crimes and Atrocities
1	WikiLeaks gets new host -- Sweden's Pirate Party - The whistleblower website WikiLeaks will place several new servers with the Swedish Pirate Party, the group which campaigns for more freedom on the Internet said Tuesday.
0	Israel Places Order For 20 Joint Strike Fighters; U.S. Taxpayers Pick Up The Tab
0	Saudi Hospitals Asked to Maim Man as Punishment: A Saudi Arabian judge has asked several hospitals in the country whether they could damage a mans spinal cord as punishment
0	"CEO of Scandinavian megabank: ""Let banks crash"" - Banks should not be treated differently than other firms"
0	"There's a traffic jam in China that's 60 miles long and has already been going on for 10 days. ""It could last for weeks"""
1	Criminalization of drug use is spreading HIV
0	An Arab democracy, with a Muslim Prime Minister and a Christian President, allowed the building of a synagogue, squarely in the center of their Ground Zero in the heart and pride of downtown Beirut
1	Vietnam Adopts George Washington's Non-Interventionist Foreign Policy - Gen. Vinh reconfirmed the three pillars of Vietnams defense policy: not joining in any military alliances or becoming a military ally of any country; not allowing any country to set up military bases in Vietnam...
0	Mexico fires 3,200 (9%) of it's federal police.
1	"To offset the spate of negative stories on the Israeli Defense Force here's the ""Combatant's Letter"", Signed by 500+ Soldiers that refuse to serve in the occupied territories. "
1	Monsanto Uprooted :: Germany Bans Cultivation of GM Corn
1	"Israel is willing to make a sweeping concession - dividing control of Jerusalem - as part of a historic final peace pact with Palestinians and drop its demand that Jerusalem would ""remain the undivided capital of Israel"""
1	"Associated Press standards editor to staff: ""Combat in Iraq is not over, and we should not uncritically repeat suggestions that it is, even if they come from senior officials. The situation on the ground in Iraq is no different today than it has been for some months."""
0	Two redditors are climbing Mt. Kilimanjaro for charity and will do your bidding at the peak. Don't squander this opportunity to let your upvotes do something awesome.
1	"""For them, there is no safe place. They are raped when harvesting crops; when going to market; when fetching water and firewood; when carrying their babies; when in their homes at night, among their loved ones."""
1	Afghan insurgents give captive reporter a cell phone to show them the Internet, so he tweets his whereabouts. 
1	"Weary of drug war, Mexico debates legalization - 
A debate about legalizing marijuana and possibly other drugs  once a taboo suggestion  is percolating in Mexico, a nation exhausted by runaway violence and a deadly drug war."
1	"Should the Pope face charges?
A renowned lawyer makes the case that the Pope should have his day in court for harbouring pedophiles"
0	IMF fears 'social explosion'
1	Joint letter opposing Pope UK state visit signed by Dawkins, Fry, Pratchett, many others
1	"Israeli media sources have confirmed that an Israeli soldier shot and killed a handcuffed Palestinian youth on Tuesday morning in Tel Aviv. Soldier says that he ""was shot accidentally from his weapon."" The 18 yr old Palestinian was killed instantly as a result of the shot in the back."
1	"Egyptian newspaper manipulate picture with Obama and other world leaders in an attempt to make their president Mubarak look like the top dog
Spoiler: ""This look shopped..."""
1	Wounded in action: An infantry unit fights its way out of an ambush in Kunar Province, Afghanistan (Holy hell. One of the soldiers takes a bullet to the helmet, but survives--it's all caught on camera.)
1	Germany is planning a direct rail link between Frankfurt and London: Journey time under 4 hours.
0	"""what you have is evidence about what real aggression is, which is the President of the United States is always insinuating that we reserve the right, at any moment, at any time, at our will, to go on to military attack on Iran, even if they dont attack us."""
0	How the CIA ran a secret army of 3,000 assassins
1	British Queen 'tried to use state poverty fund to heat Buckingham Palace'
0	Since 2003, over 200,000 people have died as a result of the Darfur conflict (source: United Nations)
1	Tapes describe U.S. servicemen killing civilians for sport
0	This week, Germany will FINALLY finish paying reparation for World War One!
0	Less than 2% of websites on Scandinavia's child porn internet filter is actually child porn
1	"Canada just passed the ""Combating Terrorist Act"" which will allow terrorism suspects to be jailed without trial for up to 12 months. So far no mainsteam Canadian media has even reported it."
0	Panama court overturns US tycoon's will to leave $50m to poor children - says it should go to his millionaire family instead
1	In Israel, a chief education official was fired after denying evolution and global warming.
1	Australian study: the only effect of legalizing prostitution is an improvement in the health of sex workers
0	Hungarian sludge spill reaches Danube river (PICTURES)
1	"The Nobel Peace Prize 2010 goes to Liu Xiaobo ""for his long and non-violent struggle for fundamental human rights in China""."
1	"""The 33 trapped Chilean miners have moved to stop any individual from profiting at the expense of the group, drawing up a legal contract to share the proceeds from the story of their ordeal."""
1	Could this be the worst piece of business in the history of the world? Last Thursday, Dublin Finance Minister Brian Lenihan handed Allied Irish Bank $4.2 billion of taxpayers' money to save it from going under. He could have bought the entire bank that morning for $832 million.
1	First Miner hoisted to freedom in Chile
0	33rd miner rescued!  Is anyone else absolutely astounded at how they've managed to pull off this entire operation?
0	WikiLeaks says Funding Has Been Blocked After Government Blacklisting: Founder Julian Assange hits out at decision by Moneybookers, which collects the whistleblowing website's donations
1	Leave it to a damn engineer.
0	Here is a country with 5% unemployment, lowest income inequality, healthcare for all, has high life expectancy, low infant mortality, near top in numeracy and literacy, low on crime, incarceration, homicides, mental illness and drug abuse. In all these it beats both the US and China by a mile!
1	"Canada's ""Most Conservative City"" elects Muslim Mayor"
1	"Front-page Uganda newspaper story featured a list of 100 homosexuals, with a bright yellow banner across it that read: ""Hang Them."" Alongside their photos were the men's names and addresses"
0	Crocodile on plane kills 19 passengers
1	"Afghanistan's President Karzai admits that his office receives $2 million a year in cash from Iran, which he uses for ""presidential expenses.""  Says that he expects it to continue.  He says that the US also provides him with ""bags of money."""
1	Iceland turns from banks to freedom of speech. Iceland wants companies from around the world to set up their servers there and publish material online without the fear of ruinous lawsuits or censorship.
0	WikiLeaks ready to drop a bombshell on Russia. But will Russians get to read about it?
0	No terror arrests in 100,000 police counter-terror searches.
1	Cambodians beaten, raped and killed at illegal detention camp funded by UN | World news | The Guardian
1	Australian man saves woman from an attacking Great White by grabbing its tail. As the girl started to sink to the bottom, he grabbed her and brought her to the surface and on board the boat
1	Paris girl survives six-storey fall unharmed - bounces off cafe awning into arms of passing doctor.
1	"Why is Shoppers Drug Mart pulling 3,500 copies of Adbusters, my magazine, off its shelves? ""A week ago, in the National Post, the Canadian Jewish Congress (CJC) accused Adbusters of anti-Semitism for publishing side-by-side photographs of the Gaza and Warsaw ghettos..."""
1	Canadian couple wins $11.2 million jackpot and gives away the entire thing. 
1	The passenger in question was observed at the beginning of the flight to be an elderly Caucasian male who appeared to have young looking hands. During the flight the subject attended the washroom and emerged an Asian looking male that appeared to be in his early 20s.
0	"If you knowingly make false statements about your 
opponent in an election in the UK, you risk the 
election being ruled void after you win."
0	Don't know if you noticed already, but there is some heavy anti-nuclear protest going on in Germany this weekend. (50.000+ protesters)
1	Why children are horrifically good soldiers - Theyre small enough to transport easily in large numbers, yet big enough to handle modern lightweight arms...They have no real sense of fear and, when indoctrinated young enough, their capacity for loyalty and for barbarism exceeds that of adults.
0	"Chinese Premier says ""I believe freedom of speech is indispensable for any country"" in interview; interview then censored by gov't in China"
0	Cyber attack on Nobel peace prize website launched. Stay classy, China.
1	Boris Johnson: George W. Bush cant fight for freedom and authorise torture. If the Wests aim is to spread the rule of law, it cannot be achieved by vile means
0	While you're getting groped by the TSA, here's a reminder of how it's done in Israel: High security, little bother
0	Major spy scandal as Norway, Denmark, Finland, Sweden and Iceland catch the U.S. watching their citizens
1	Remand request issued for WikiLeaks founder Julian Assange - The Local
1	"Mayor of London, Boris Johnson, advises George W. Bush not to bring his book tour to Britain, because ""he might never see Texas again."""
0	Tim Berners-Lee, creator of the world wide web, warns that we need to defend the web, or else it could break up into fragmented islands, led by Apple, Facebook and Google.
0	North Korea has fired several artillery shells across its western maritime border, prompting return fire from South Korea
1	All 29 trapped New Zealand miners are believed to be dead following a second explosion in the Pike River Coal mine
0	"""I didn't understand quite how bad things had become in this country until I saw armed cops being deployed against schoolchildren in the middle of Whitehall."""
0	The hypocrisy of the media attack on Wikileaks - The traditional media has become so toothless it is reduced to attacking Wikileaks for doing its job properly.
0	Ecuador offers WikiLeak's founder Assange residency, no questions asked.
1	"Noam Chomsky on declaring Wikileaks a 'terrorist organization': ""Outlandish. ... One of the major reasons for government secrecy is to protect the government from its own population."""
1	If you truly support WikiLeaks, why not support Bradley Manning, the US solider who leaked the documents in the first place?
1	WikiLeaks vanishes from web as US company removes DNS support | Media | guardian.co.uk
0	Razor 1911: Because of the recent efforts to close down wikileaks. We have decided to join up in the mass-mirroring of the site. For free journalism on a free internet.
0	Wikileaks: May I remind you that the same collective now being persecuted as a 'terrorist organisation recently received Amnesty International's New Media Award for reports on human rights abuses in Kenya.
1	MC Hammered: Mastercard downed under DDOS overnight
0	WikiLeaks payment firm to sue Visa, MasterCard
1	"Wikileaks. Brazil's President Lula defends Assange: ""Instead of blaming someone who has disclosed these documents, those who wrote them should be blamed"""
1	WikiLeaks copycats are popping up all over the world: IndoLeaks, BrusselsLeaks And BalkanLeaks
1	Relatives of Spanish cameraman killed in Baghdad use WikiLeaks to press for justice: After years of delays, the family of a Spanish journalist killed in a 2003 US attack on a Baghdad hotel turns to WikiLeaks documents that suggest the US and Spain colluded to prevent legal action!
0	The inhumane detention conditions of Bradley Manning - Glenn Greenwald - Salon.com
1	"""We now know that Visa, Mastercard, PayPal and others are instruments of US foreign policy"" - Julian Assange"
0	Richard Stallman: The actions against MasterCard and Amazon are not 'hacking'. People are just finding a way to protest in a digital space, the internet equivalent of a mass demonstration | guardian.co.uk
0	Visa, Mastercard and PayPal all enable donations to be made to US-registered groups funding illegal Israeli settlements in the West Bank in defiance of international law.
1	Reporters without borders to host mirror site of Wikileaks
1	Spanish parliament rejects anti-downloading law that would have allowed the courts to close down p2p websites. Wikileaks revealed the US bullied Spain into trying to pass this law. Rest of the world: it's your turn to stand firm against those who try to impose internet censorship. You can do it too!
1	UN's top torture official now investigating WikilLeaker Cpl. Brad Manning's pre-trial prison conditions.  USA may soon be labelled a nation that engages in torture.
0	Al Jazeera has put out their Top 10 stories of 2010.  I think it's more deserving of our traffic and attention than Time's Bogus Person of the Year gag, not to mention all the other pointless polls people try to influence.  
1	The Paper That Finally Changed The Law on Drugs: Published in The Lancet, the paper demonstrates  clear scientific evidence that opposes UK drugs policy. The Government respond by removing from law the need to have a scientist on the Advisory Council for the Misuse of Drugs!
1	USA forced Sweden's hand on piracy and Pirate Bay crackdown
0	Chinese villager with a history of speaking out against government abuse found dead due to a traffic accident. Except Chinese netizens suspect that he may have been held down by four men as he was run over by a truck.
1	Julian Assange Threatens To Name Arab Leaders With CIA Ties
1	Wikileaks releases cable of the July 1990 meeting between then-US Ambassador to Iraq, April Glaspie, and Saddam before the Kuwait invasion: Saddam's message of friendship to President Bush
1	Punjab(Pakistan) governor Salman Taseer assassinated in Islamabad
1	"Cable from the U.S. Embassy in Tel Aviv says Israeli officials wanted Gaza's economy ""functioning at the lowest level possible consistent with avoiding a humanitarian crisis."""
0	Italy becomes the first country to ban plastic bags nationwide!
0	"Egypt's Muslims attend Coptic Christmas mass, serving as ""human shields"""
0	Russia's Murrow moment - Leonid Parfyonov's stunning speech to Russian TV executives in November was ignored by Russian state television, but you can watch it on YouTube. His audience listened in deadpan shock as Parfyonov said out loud what everyone in Russia knows to be the truth.
1	Uh, reddit? Brisbane, AU (one of our largest cities) is currently being washed away. Massive floods, death toll rising. 
1	West African farmers have succeeded in cutting the use of toxic pesticides, increasing yields and incomes and diversifying farming systems as a result of an international project promoting sustainable farming practices.
0	Aussie here: Just want everyone to know that Brazil and Sri Lanka are suffering flooding too, and probably need more aid than we do. (120,000 homeless, hundreds dead)
1	Haiti reconstruction firms only get $1.60 for every $100, rest goes back to American companies.
1	"Mauritanian Islamic leaders issue a fatwa banning 
female genital mutilation (FGM)"
0	"Several thousand Israelis protested in Tel Aviv waving the Israeli flag and Palestinian ones: ""We came to protest against the government's policies and the lack of democracy in our country"""
